,ID,Heading,Heading Text
5,25,WHAT YOU LOVE ABOUT US:,"The Knot Worldwide offers a unique employee experience and we are deeply proud of our award-winning culture. From flexible vacation and generous parental leave benefits to promoting wellness and giving back to our community, we believe in happiness above all else—in and out of the office."
6,25,--,This position is not eligible for sponsorship.
7,25,--,"If you are a resident of California, by submitting your application, you acknowledge that you’ve read the California Privacy Notice."
0,26,Entry,
1,26,Job Description,"Resideo is reinventing how we look at the home by understanding and improving the silent networks within the home: Water, Comfort, Energy and Security. As the Sr. Software Engineer in the Energy space, you’ll help build the connected services products that include IoT, SaaS and Cloud Analytics to enable service Pros to remotely diagnose problems with home equipment, create predictive maintenance plans and provide homeowners piece of mind by knowing that a pro is watching over their complex HVAC equipment."
2,26,Essential Responsibilities,"LifeWhere does predictive analytics on heating and cooling equipment. The intern will work with our team to build and refine analytic solutions to help us detect unit failures and developing issues with the units. We will work with the intern to ensure success, but we will give them a real project that will end up in deployment to help us improve our predictive analytic capabilities."
3,26,Job Duties,"Help the team develop analytics for home heating and cooling equipment Implement analytics in C# and Azure ML Exhibit the LifeWhere Core Values of accountability, integrity, respect, innovation and teamwork in all your professional dealing. Improve the process for collaboration internal and with our customers. Complete necessary documentation in a timely manner (Timecards by 5pm on Friday, expenses by the 20th of each month, etc.) Other duties as assigned"
4,26,You Must Have,Working toward a Bachelor’s or Master’s degree in Data Science or related field
5,26,We Value,"Understanding various software development life cycle Demonstrate the ability to develop efficient and high-quality work Knowledge of best practices and new techniques in data science Diverse and global teaming and collaboration Effective communicator Can quickly analyze, incorporate and apply new information and concepts Ability to consistently make timely decisions even in the face of complexity, balancing systematic analysis with decisiveness Ability to convey subtle or complex messages clearly, as appropriate for the topic and audience Some relevant experience a plus"
6,26,About Us,"Resideo is a leading global provider of critical comfort and security solutions primarily in residential environments and distributor of low-voltage electronic and security products. Building on a 130-year heritage, Resideo has a presence in more than 150 million homes, with 15 million systems installed in homes each year. We continue to serve more than 110,000 professionals through leading distributors, including our ADI Global Distribution business, which exports to more than 100 countries from more than 200 stocking locations around the world. Resideo is a $5.0 billion company with approximately 13,000 global employees. For more information about Resideo, please visit www.resideo.com ."
0,27,Entry,
1,27,Summary,"At Apple, new ideas have a way of becoming great products, services, and customer experiences very quickly. Bring passion and dedication to your job and there's no telling what you could accomplish."
2,27,Key Qualifications,Strong communicator with excellent verbal and written presentation skills - able to evangelize data informed decision-making at all levels.
3,27,"Highly detail-oriented, organized, and patient.","Strong working knowledge of SQL, Teradata preferred"
4,27,Description,"Apple Marcom is seeking a Data Scientist to design, engineer, develop analytical dashboards and solutions that have direct and measurable impact to www.apple.com as well as Apple’s digital media and social media campaigns."
5,27,Education & Experience,"BS or equivalent Degree - Marketing, Finance, Business Analytics, or related fields. Master’s degree in Business Administration or Marketing Science is desirable."
0,28,Entry,"Lead analytics and measurement efforts for strategic accounts using the LXM approach – e.g., Existing and new promising accounts.Proactively identify and define data and learning opportunities that solve or support client objectives and create visibility to performance and the levers that drive it.Participate in client team scoping and road-mapping to ensure analytics needs are properly planned and are visible to and supported by the client and delivery teams.Develop measurement plans and strategies to provide program insights, address learning objectives and improve program effectiveness.Develop blueprints, learning roadmaps, work proposals, and data strategy presentations that outline solutions that measure against the client’s objectives and provide insights that reveal or empower opportunities for improving performance.Provide thought leadership and act as the subject matter expert in the deployment of data-driven solutions, measurement, and analytics – be familiar with multiple approaches and recommend the one that best drives to the client need.Oversee the full analytics lifecycle from problem identification, solutioning, requirements development, solution creation and results delivery.Write and/or review briefs to external resources that define and specify requirements for more in-depth analytics projects (exploratory, descriptive, and predictive analytics, ML, AI) and lead/oversee the delivery of solutions from the results.Complete the work with a cogent presentation of findings with actionable recommendations.Where needed, apply statistical concepts and techniques to analyze experiments and predict user behavior and behavioral drivers for accuracy and client alignment."
1,28,Additional Information,"Merkle fosters a diverse environment that encourages original thinking about our business and empowers us to communicate with a global world of customers. We embrace differences of opinion and diversity of thought as they help us challenge and refine our solutions. Merkle, as a best-in-class marketing agency, welcomes big ideas, and believes they can come from anywhere."
2,28,Perks & Benefits,"Merkle offers a flexible vacation policy, retirement benefits, paid sick leave, generous health, dental and vision insurance options, parental leave, adoption benefits, and more. We recognize high-performers and provide long-term growth opportunities. We hope you'll join us!"
3,28,FLSA Status: Exempt,
4,28,Desired Skills and Experience,"4+ years’ experience in data science or analytics roles delivering campaign and audience measurement, data-driven insights, predictive modeling, and recommendations to internal or external clients.Ability to articulate analytics expertise through the work of others – by leading technical resources to perform the analyses and leading the client team through recommending, championing, and briefing those analyses.Demonstrated strong presentation and storytelling with data skills. Be able to deliver clear value while simplifying the complexity for business audience and partnering with other disciplines to deliver recommendations.Familiarity and some experience using predictive modeling approaches, including machine learning, AI, clustering, regression, ensemble modeling, and decision trees.Ability to query, manipulate, extract, and analyze structured data from large data repositories to generate actionable insights that deliver business resultsFamiliarity with experimental design and offer testing methodologyExperience with cloud-based big data platforms – e.g., Redshift, Big Query, Teradata.Bachelor’s degree or master’s (preferred) in a quantitative field (STEM or quantitative social sciences) and/or MBA with strong quant background.Strong organizational skills – task prioritization, effective time management, meeting facilitation, conflict resolution, and risk identification/mitigationStrong business skills – understand and identify key business levers and tailor recommendations that tap them.Knowledge of the digital marketing ecosystem and fluency with common web technologies is strongly preferredStrong strategic thinking and prioritization skillsExperience with Power BI or other front-end visualization tool is a plus"
0,29,Entry,
1,29,Summary,"Do you get excited by driving product impact via measurement and evaluation, for products and services used by hundreds of millions of people globally?"
2,29,Key Qualifications,Experience articulating and translating business questions and using statistical techniques to arrive at an answer using available data.
3,29,Description,"The goal of the Siri Search team is to take Siri search to the next level of intelligence and accuracy using advanced statistical techniques. The Data Scientist role in this team has a spectrum of approaches to improving Siri search, including"
4,29,Education & Experience,"An academic background is in quantitative field such as Statistics, Operational Research, Bioinformatics, Economics, Computer Science, Sociology, Mathematics, Physics, or similar quantitative field. Prefer advanced degree + 2 years of relevant industry experience."
0,30,Entry,
1,30,Summary,"At Apple, new ideas have a way of becoming great products, services, and customer experiences very quickly. Bring passion and dedication to your job and there's no telling what you could accomplish."
2,30,Key Qualifications,Strong communicator with excellent verbal and written presentation skills - able to evangelize data informed decision-making at all levels.
3,30,"Highly detail-oriented, organized, and patient.","Strong working knowledge of SQL, Teradata preferred"
4,30,Description,"Apple Marcom is seeking a Data Scientist to design, engineer, develop analytical dashboards and solutions that have direct and measurable impact to www.apple.com as well as Apple’s digital media and social media campaigns."
5,30,Education & Experience,"BS or equivalent Degree - Marketing, Finance, Business Analytics, or related fields. Master’s degree in Business Administration or Marketing Science is desirable."
0,31,Entry,Come see what’s cookin’ at HelloFresh!
1,31,Job Description,"We’re hiring a Growth Analytics Data Scientist to support cross-brand insights to scale our businesses profitably. The role will develop marketing optimization and digital product optimization through in-depth analytical insights and experimentation. You will support the development of analytical capabilities for one of the fastest-growing US food brands and be the champion of a data-centric approach to our marketing and digital product operations. You will be working collaboratively with data engineering, business intelligence, data science, and to provide effective and high impact data solutions."
2,31,You will …,"Analyze complex business problems using large datasets from internal and external sources to provide deep insight and recommendations to decision-makers Support the development of analytical platform and reporting capabilities Lead the development of self-service reporting tools, produce complex analytical models, develop forecasts, and drive predictive and prescriptive data solutions Enhance and maintain measurement and reporting for the growth marketing organization Collaborate with stakeholders and partners within the data organization to drive analytical projects including channel mix optimization, targeting strategies, testing, performance analysis, and reporting solutions"
3,31,You are …,"Results-oriented - You love transforming data into meaningful outcomes Gritty - When you encounter obstacles you find creative solutions Intellectually curious – You love to understand why things are the way they are, how things work, and challenge the status quo A team player – You favor team victories over individual success A structured problem solver – You possess strong organizational skills and consistently demonstrate a methodical approach to all your work Agile – You thrive in fast-paced and dynamic environments and are comfortable working autonomously A critical thinker – You use logic to identify opportunities, evaluate alternatives, and synthesize and present critical information to solve complex problems."
4,31,You’ll get …,"Competitive Salary & 401k company match that vests immediately upon participation Generous parental leave of 16 weeks & PTO policy $0 monthly premium and other flexible health plans effective first day of employment 75% discount on your subscription to HelloFresh (as well as other product initiatives) Snacks, cold brew on tap & monthly catered lunches Company-sponsored outings & Employee Resource Groups Collaborative, dynamic work environment within a fast-paced, mission-driven company"
0,32,Entry,
1,32,Summary,"Join the team that provides software security technologies to help users protect their accounts. We believe in transforming your smartphone into a device that secures your digital life without sacrificing your privacy. We are seeking a data scientist that will develop solutions to bring order to unstructured data using modeling techniques. A successful candidate will have a bent for applied research with expertise in pattern mining, anomaly detection, predictive modeling, classification and optimization. The candidate will take end-to-end responsibility for translating customer needs into analytical solutions from feature engineering, implementation, model training and reporting. The role requires working in a fast paced environment, handling multiple assignments and being self driven. Candidates also need to show initiative and be able to take ownership of a problem area."
2,32,Key Qualifications,"Strong working knowledge of data mining algorithms including classifiers, clustering algorithms and anomaly detection techniques"
3,32,Passion for problem-solving and analysis,"Highly motivated and organized, with the ability to accept ambiguity and deliver exceptional results on tight schedules"
4,32,Description,"Apple is looking for a data scientist to work on our software security technologies to develop and launch new products. You will work hand-in-hand with security engineers, software engineers, program managers and business partners to understand problems, define data-driven solutions, execute plans and communicate results on a regular basis."
5,32,Education & Experience,"MS or PhD in quantitative field, such as Computer Science, Applied Mathematics, or Statistics, or equivalent industry experience"
0,33,Entry,
1,33,About you:,"Currently pursuing, or have completed a bachelor's degree in a relevant analytics field. This can range from a degree in finance or economics to something along the lines of political science."
2,33,Bonus:,
3,33,Demonstrated interest in real estate,Desire to be a part of a small but rapidly growing company that requires employees to be multi faceted and adaptable.
4,33,Your impact:,Work alongside web developers to implement beneficial changes to the platform
5,33,Perks and Benefits:,
6,33,Competitive compensation,"Perchwell provides equal employment opportunities to all employees and applicants for employment and prohibits discrimination and harassment of any type without regard to race, color, religion, age, sex, national origin, disability status, genetics, protected veteran status, sexual orientation, gender identity or expression, or any other characteristic protected by federal, state or local laws."
0,34,Entry,"We are an intellectually diverse team of economists, statisticians, engineers, and other analytics professionals, focused on quantitative modeling within CCB at JPMorgan Chase & Co. The team answers complex and unique questions, utilizing cutting edge quantitative and computational techniques and leveraging one of the world's largest repositories of consumer data. We work closely with our partners throughout JPMorgan Chase to assess and execute critical business decisions."
1,34,Responsibilities:,Apply critical thinking skills and perform advanced analytics with the goal of solving complex and multi-faceted business problems.
2,34,Mentor junior team members,
3,34,Qualifications:,"Deep quantitative/programming background with a graduate degree (M.S., Ph.D.) in Statistics, Engineering, Computer Science, Mathematics, Operations Research, or Economics,"
4,34,Equal Opportunity Employer/Disability/Veterans,Significant experience working with very large scale (structured and unstructured) data.
0,35,Entry,"Who we are: Fueled by a fundamental belief that having access to financial services creates opportunity, PayPal (NASDAQ: PYPL) is committed to democratizing financial services and empowering people and businesses to join and thrive in the global economy. Our open digital payments platform gives PayPal’s 375 million active account holders the confidence to connect and transact in new and powerful ways, whether they are online, on a mobile device, in an app, or in person. Through a combination of technological innovation and strategic partnerships, PayPal creates better ways to manage and move money, and offers choice and flexibility when sending payments, paying or getting paid. Available in more than 200 markets around the world, the PayPal platform, including Braintree, Venmo and Xoom enables consumers and merchants to receive money in more than 100 currencies, withdraw funds in 56 currencies and hold balances in their PayPal accounts in 25 currencies."
1,35,Job Description:,
2,35,Key Responsibilities,Understand how to make data visually appealing and simple to both navigate and comprehend for end-users
3,35,Basic Requirements:,"Must be earning a Bachelor’s or Master’s degree in Computer Science, Math, Statistics or related field"
4,35,Position Location: Varies,"We're a purpose-driven company whose beliefs are the foundation for how we conduct business every day. We hold ourselves to our One Team Behaviors which demand that we hold the highest ethical standards, to empower an open and diverse workplace, and strive to treat everyone who is touched by our business with dignity and respect. Our employees challenge the status quo, ask questions, and find solutions. We want to break down barriers to financial empowerment. Join us as we change the way the world defines financial freedom."
0,36,Entry,
1,36,The Role:,"The Data Technician role is an entry-level position suitable for someone looking to break into the startup/big data world and gain experience working with top tier data scientists and software engineers, helping clean and manage the data used in our models."
2,36,Requirements:,
3,36,Qualifications:,
4,36,Detail-oriented personality,
5,36,Excellent communication skills,
6,36,Proactive in improving existing methods/tools,
7,36,Responsible and reliable,Technical Skills (highly preferred but not required):
8,36,"Python, JavaScript, HTML",
9,36,"Pandas, PostgreSQL",
10,36,Web scraping,
11,36,Why Thasos?,"Winner – “Best Alternative Data Provider, 2018” Inside Market Data"
12,36,Company-sponsored lunch every Thursday,"Regular company outings (happy hours, hikes)"
0,37,Entry,"New York State will hire and train a team of staff working remotely to support the NYS Department of Health (NYSDOH) and Local Health Departments (LHDs) to perform COVID-19 contact tracing in communities across NYS. The aim of this initiative will be to call every person diagnosed with COVID-19, establish all contacts of this person, and proceed to call and maintain ongoing communication with every contact. In addition, the team will support the isolation and quarantine of individuals, as appropriate in cooperation with the LHD. This includes virtual needs checks and referral to community resources as needed. This contact tracing initiative is in tandem with statewide-wide efforts to increase testing, improve communication and knowledge of effective strategies to reduce transmission, and implementation of isolation and quarantine. This will fortify efforts to control the pandemic in NYS."
1,37,General Summary:,"The Contact Tracer will use a web-based client resource management (CRM) platform to call all contacts of anyone diagnosed with COVID-19, determine exposure, assess symptoms, refer for testing according to established protocols, and provide them with instructions for isolation or quarantine. Contact Tracers will maintain ongoing communication with contacts to assess symptoms, ensure compliance with quarantine and determine social support needs and/or handle reporting of issues that arise. Contact Tracers are required to follow set scripts and adhere to policies and procedures provided by NYS. They will also comply with Department training regarding confidential information related to personal information. COVID-19 Contract Tracers will be required to work a minimum of 20 hours per week."
2,37,Minimum Qualifications:,"High school diploma, or equivalent required. Must be 18 years of age or older. Some college training preferred."
3,37,Must be a NYS resident.,"Ability to speak, read, and write English clearly and concisely. Fluency in a second or multiple languages would be a plus."
4,37,A headset is preferred.,
5,37,Preferred Skills:,"Ability to exhibit a professional, positive attitude and independent work ethic."
6,37,Excellent organizational and communication skills.,
7,37,Sound judgment required.,Ability to handle confidential information with discretion and professionalism.
0,38,Entry,
1,38,About Us,"Decode_M is a new kind of insights and strategy firm. We Decode Data into Momentum™ for individuals, organizations and movements. This means, for each client in our diverse portfolio (think Estee Lauder Companies, Airbnb, WeWork, Brooklyn Brewery, the NHL), we use wide-ranging data sources to diagnose what’s most in the way of our clients’ ambition and then advise them on how to move forward."
2,38,The Opportunity,"We’re actively looking to recruit a Junior Data Scientist with 1-3 years of experience who, among other things, can support the team in developing scalable data solutions for the team and our client challenges. This position, based in New York City, requires a strong interest in digital, analytics, data science, and quantitative and qualitative research, a natural curiosity, an eagerness to dive into the deep end, and a hunger to learn and grow while having a blast. Expect to learn a lot about cool companies, new products, and the latest in digital, analytics, research and strategy."
3,38,Who You Are,You’ve solved a difficult or time-intensive problem by writing a quick program
4,38,What You'll Do,"Build Data Tools: Extract data from social media, online reviews, mainstream media sites, search, web traffic, etc. to uncover intelligence around growth opportunities and business challenges."
5,38,Skills/Qualifications,"You are proficient with Python, R, SQL, and Microsoft Excel; you have experience working with APIs"
6,38,How To Apply,Send your resume and a cover letter to jobs@decode-m.com.
0,39,Entry,
1,39,CIVILIAN COMPLAINT REVIEW BD,
2,39,Job Posting Notice,
3,39,Job ID,
4,39,458578,
5,39,Business Title,
6,39,Civilian Assistance Unit Advocate,
7,39,Civil Service Title,
8,39,INVESTIGATOR (CCRB),
9,39,Title Classification,
10,39,Non-Competitive,
11,39,Job Category,"Constituent Services & Community Programs, Public Safety, Inspections, & Enforcement, Social Services"
12,39,Career Level,
13,39,Experienced (non-manager),
14,39,Work Location,
15,39,"100 Church St., N.Y.",
16,39,Division/Work Unit,
17,39,Civilian Complaint Review Bd,
18,39,# of Positions,
19,39,2,
20,39,Title Code No,
21,39,31165,
22,39,Level,
23,39,02,
24,39,Proposed Salary Range,"$ 58,167.00 - $ 58,167.00 (Annual)"
25,39,Job Description,"The Civilian Complaint Review Board (CCRB) receives and investigates approximately 5,000 complaints each year. The largest civilian oversight agency in the United States, the CCRB is an"
26,39,Civilian Assistance Unit (CAU),"The Unit will aid those who reportedly experienced trauma following a police encounter, with specific assistance provided for those who have reported sexual assault or other types of serious"
27,39,Tasks and Responsibilities:,"Assists civilians in recovering from the physical, emotional, and financial impact of traumaConducts psychosocial assessment and determines needs of civiliansProvides resources, referrals, and assistance with victim's compensation, burial assistance, housing/relocation, clothing, food, transportation, medical services, counseling, mentoring, or other"
28,39,appropriate services,"Provides support and assistance to civilians navigating CCRB processResponds to inquiries and requests; explains the Victim Bill of Rights and judicial processesNotifies civilians of any status changes in case proceedings, such as hearing dates, case status and outcomes, and other pertinent informationCommunicates with Administrative Prosecution Unit, Investigators, community service providersUses phone, email, written correspondence, and in-person meetings to make contact and follow-up with civiliansAccompanies civilians to investigator and attorney interviews as needed to provide support and guidanceCommunicates with Administrative Prosecution Unit, Investigators, community service providers, volunteers, interns, the public, and other individuals as needed to coordinate work, activities"
29,39,Minimum Qual Requirements,1. A baccalaureate degree from an accredited college or university
30,39,Preferred Skills,"Bachelor’s degree in social work, criminal justice,psychology or a related field required;"
31,39,Foreign language proficiency a plus.,
