,ID,Heading,Heading Text
0,71,Entry,"About you: Currently pursuing, or have completed a bachelor's degree in a relevant analytics field. This can range from a degree in finance or economics to something along the lines of political science. Applicable coursework having to do with analysis and critical thinking to effectively interpret data Strong skills using data processing software (Microsoft Excel, Tableau, etc.) Be able to work independently as well as collaborate with others. Making sure you can own and understand trends to make our platform more effective is critical. Bonus: Demonstrated interest in real estate Desire to be a part of a small but rapidly growing company that requires employees to be multi faceted and adaptable. We’re looking for a hard working individual who is keen to start building something from day one. This person should be constantly trying to learn and develop the inner workings of Perchwell to insure an intuitive product for our customers. At Perchwell we are constantly challenging the norms of the real estate analytics market and trying to give agents as well as brokerages all the information they need to understand the market as a whole. This role has a significant effect on how we show and process data. The learning curve is very steep so the ideal candidate must be motivated to learn quickly. Your impact: Work alongside web developers to implement beneficial changes to the platform Daily data review and clean up as data comes in through various sources. This involves constantly looking for trends and patterns to better the process and become more efficient. Provide quarterly data and analyses to clients in order to support market updates and insights into general market trends. Think about the data creatively to reduce time spent processing individual nodes Drive the backend of the software platform and strive to build a more comprehensive database Perform ad-hoc analysis to review and check data as new features, markets and initiatives are rolled out. Collaborate with engineers, product and customer success teams to identify existing or new problems and come up with solutions to address and fix them. Identify projects and initiatives to improve data and be more efficient when expanding to new markets. Contribute to the development of something new in the real estate field Projects we’ve tackled in the past: Quarterly market reports for major real estate brokerages Designing a new interface for defining and documenting incorrect unit floor numbers in buildings Creating a system to designate private outdoor space for individual units Research and compile NYC neighborhood boundaries for different clients Perchwell is a market intelligence, search and collaboration solution for real estate professionals and their clients. As a complete workflow solution, Perchwell allows agents to provide differentiated service to clients more efficiently and grow their businesses as a result. We're built on a comprehensive database of real estate data constructed from myriad public and private sources. Together, these data provide a rich foundation for evaluating the market and help professionals develop hyper-personalized, actionable insights in seconds. Perks and Benefits: Competitive compensation Perchwell provides equal employment opportunities to all employees and applicants for employment and prohibits discrimination and harassment of any type without regard to race, color, religion, age, sex, national origin, disability status, genetics, protected veteran status, sexual orientation, gender identity or expression, or any other characteristic protected by federal, state or local laws. This policy applies to all terms and conditions of employment, including recruiting, hiring, placement, promotion, termination, layoff, recall, transfer, leaves of absence, compensation and training."
0,72,Entry,"2021 Summer Internships – Sidney, NY The Role Amphenol Aerospace Operations is seeking Summer Interns to work out of its brand new, state-of-the-art facility in Sidney, NY. The successful candidate will intern in one of the internship programs listed below. Electrical Engineering Internship - Aid in designing and testing electrical circuit board assemblies and systems. Mechanical Engineering Internship – Work with Amphenol's release system, drawing format, and design considerations. Update plant layouts and process layouts to new standards. Quality Engineering Internship – Support overall Quality of products through statistical data compilation and analysis, reverse engineering and corrective action implementation. The Company Now expanding our footprint into a newly constructed site in Mesa, Amphenol Aerospace Operations has been a leader in designing and manufacturing electrical components for the aviation and commercial airplane industry for over 85 years. Focusing on serving the needs of advanced and challenging market segments, we pride ourselves on our consistent ability to innovate and provide the markets with new creative solutions. The Person The key skills and qualities of a Summer Intern at Amphenol Aerospace Operations: Enrolled in a 4-year accredited university as a Freshman, Sophomore, or Junior within a relevant degree program for the internship in which they are applying. All Summer Internships pay $18/hour, the hours are Monday through Friday, 8 am – 5 pm (EST). The Internships run from May – August. If you are keen on joining this exciting, forward thinking company, then submit your application along with a cover letter. Within the cover letter, please specify what internship you are applying for. The candidate must be able to legally work in the United States; we are unable to provide sponsorship."
0,73,Entry,"New york city, New York - United States | Posted - 09/11/20 Overview Opportunity for “Database Developer III” in NYC, NY. Kindly go through the requirement and let me know your interest to discuss further about this role Here are the details: Job Title: Database Developer III Location: NYC, NY (REMOTE JOB) Duration: 12 months contract Job Description: Looking for a Database Developer with the below: 1. Informatica Enterprise Data Catalog 2. Data Catalog Application development. 3. Data Scanning Regards, Viduth | Direct : +1 248 313 4594 | Email: Viduth.Selvan@technosoftcorp.com | www.technosoftcorp.com |"
1,73,Informatica Enterprise Data Catalog.,
0,74,Entry,"Data, Research & Insights Data Science The mission of our Premium Analytics Team is to bring Spotify Premium to more users across the globe and to constantly evolve and improve our offering. You'll be a crucial partner in guiding decisions for crafting the Premium of the future. At your fingertips you’ll have access to petabytes of data, and will get the opportunity to be creative with how you drive insights from that. Above all, your work will impact the way the world experiences music. Location New York, NY Job type Permanent You will work with a global team of outstanding analysts, data scientists, business managers and engineers. We are all passionate about what we do, and move forward with high impact projects at a fast pace. Learning and improving is part of our daily routine, and you will be free to develop your own skills and ways of working. What you'll do Drive business decisions and help tailor our offerings, by analyzing troves of data Work with business managers & developers to understand the change they are driving, help them discover new opportunities, and forecast the impact of new business initiatives Design custom analyses to answer strategic business questions. Very little of what you do will be standard, out-of-the-box analysis. Be an experienced sounding board to our business managers and partners Define meaningful metrics and build scalable data pipelines and dashboards to monitor them Who you are You have 3+ years of professional experience in data science, analytics, research, consulting or other related fields Comfortable analyzing large datasets with statistical precision using tools such as SQL, Python, R, SAS, Stata, or other programming languages Results-oriented person who enjoys tackling loosely defined problems Bias toward delivering actionable insights quickly rather than constructing the most technically sophisticated model. Phenomenal communication skills and value building positive relationships with colleagues and stakeholders. You have the ability to explain sophisticated topics in simple terms to a variety of audiences Interested in or have experience with business strategy or management consulting Perks of being in the band Extensive learning opportunities, through our dedicated team, GreenHouse. Flexible share incentives letting you choose how you share in our success. Global parental leave, six months off - fully paid - for all new parents. All The Feels, our employee assistance program and self-care hub. Flexible public holidays, swap days off according to your values and beliefs. Spotify On Tour, join your colleagues on trips to industry festivals and events. Learn about life at Spotify You are welcome at Spotify for who you are, no matter where you come from, what you look like, or what’s playing in your headphones. Our platform is for everyone, and so is our workplace. The more voices we have represented and amplified in our business, the more we will all thrive, contribute, and be forward-thinking! So bring us your personal experience, your perspectives, and your background. It’s in our differences that we will find the power to keep revolutionizing the way the world listens. Spotify transformed music listening forever when we launched in 2008. Our mission is to unlock the potential of human creativity by giving a million creative artists the opportunity to live off their art and billions of fans the chance to enjoy and be passionate about these creators. Everything we do is driven by our love for music and podcasting. Today, we are the world’s most popular audio streaming subscription service with a community of more than 345 million users."
0,75,Entry,"At Catholic Health, our primary focus is the way we treat and serve our communities. We work collaboratively to provide compassionate care and utilize evidence based practice to improve outcomes to every patient, every time. We are committed to caring for Long Island. Be a part of our team of healthcare heroes. Catholic Health is also proud to be voted one of Newsday's Top Places to Work on Long Island in 2018 and 2019 and Modern Healthcare's Best Place to work in both 2019 and 2020. Position Summary: In this role you will design and implement data-driven insights to drive CHSPP's Value-Based programs performance and improve outcomes for CHS's patients/families. You will support stakeholders through the analytics lifecycle from development/planning, testing/validation, implementation, training, and deployment. Duties/Responsibilities: Development and planning: Identify opportunities and risks; developing scenario models; create information to guide the actions and operationalization of improvement efforts. Testing/Validation: Utilize data stewardship, ensuring proper data structure, build automated assessment. Implementation: forecast performance results and support client-specific areas of interest and adoption of analytics. Training/Deployment: Act as liaison/analyst for internal stakeholders, understand their needs and translate them into education, adoption, and improving patient outcomes. Responsible Subject Matter /Training Expert for Single Source of Truth Data Sources and KPI's. Position Requirements/Qualifications: Degree/Certifications in a relevant quantitative field of study is preferred. 1 to 3 years of analytics development experience for a health provider, health plan or accountable care organization including either: experience working in a health plan or consulting actuarial, financial reporting or medical economics departments or experience working in healthcare provider analytics related to managed-care, population management, clinical or financial decision support. Demonstrable data skills using tools like SQL, R, SAS, desired. Demonstrable experience with a wide variety of analytical or statistical methods. Effective ability to simplify communication by describing complex topics in understandable terms to varying audiences. Demonstrated ability to articulate goals, plan and implement processes to achieve those goals, recognize and assess the implications of confounding variables, and meet deadlines"
0,76,Entry,"MINIMUM QUALIFICATIONS: Associates Degree in Computer Science or equivalent combination of education or experience. Proficiency in MS Excel. Yearly Physical (required within 1 month of initial hire date) Valid NYS Driver’s License (copy required upon initial hire date) PREFERRED: Experience with SQL, scripting, reports systems and related experience. HOURS: Monday – Friday 8:00 – 5:00 Must be flexible to meet the needs of the program POSITION OBJECTIVES: To enhance WGA business applications and output capabilities by creating and integrating report building systems and data collection forms. To build and improve automated data synchronizations between business portal and other existing and future software applications. To modernize and upgrade business forms and processes on new and existing platforms. To enhance the availability of actionable data to staff through the use of reports, live visualizations and/or dashboards DUTIES AND RESPONSIBILITIES OF THE JOB: Use the Welligent EHR and other platforms to develop forms and workflows in coordination with WGA staff. Work with outside vendors to develop data exchange parameters and test results to ensure fidelity. Work with WGA staff to develop and support relevant data visualizations. Produce and maintain documentation of automation processes and software integrations. Convert existing WGA forms to consolidate platforms. Develop a strong understanding of Welligent EHR, and the Welligent EHR Oracle report database to enable the extraction and connection of systems to data sources as well as providing tools and training for data retrieval to personnel. POSITION LEVEL: Reports to IT Director"
0,77,Entry,"Company Description Broadridge Financial Solutions, Inc. (BR), a $4 billion global Fintech leader and part of the S&P 500® Index, is a leading provider of investor communications and technology-driven solutions to banks, broker-dealers, asset and wealth managers and corporate issuers. At Broadridge, we do well by doing good. Our unique culture is guided by the Service-Profit Chain—the idea that success is mutual, directly connecting employee engagement, client satisfaction, and the creation of stockholder value. We enable better financial lives by powering investing, governance, and communications for our clients, their customers, and the financial services industry. Job Description Broadridge continues to experience strong growth! We are currently seeking a Data Analyst Associate to support key reporting functions during the critical Proxy Season. In this role, you will primarily focus on data compilation and analysis with regard to proxy voting and entitlements. This role will also involve aspects of project management, trouble-shooting, and identifying potential process improvements. Are you looking to join a dynamic team where you can immediately contribute? If so, we would love to hear from you! This is a temporary, contract role. Duties include: Run and download reports from various systems and consolidate, analyze, reconcile as needed Create adhoc reports and data extracts for internal associates and/or external clients Collaborate with team to analyze data and determine actions needed Work with other associates to process information Host status meetings with internal associates, supervise progress, takeaways etc Structure large data sets to find usable information Use graphs, infographics and other methods to visualize data Build presentations and reports based on recommendations and findings Work with executives and other business leaders to find opportunities for improvement Skills required: Solid understanding of MS Office Suite Proficiency in MS Excel, including Macros, V Look-ups, Pivot Tables Knowledge of data gathering, cleansing and transforming techniques Ability to set and meet deadlines Good attention to detail Strong written/verbal communication skills Ability to QA and troubleshoot data #LI-AH1 Additional Information Broadridge is an equal opportunity employer and makes employment decisions without regard to race, color, religion, sex, sexual orientation, gender identity, national origin, protected veteran status, disability, age or any other protected status. ""Everyone Benefits from Diversity & Inclusion. Diverse & Inclusive Teams Drive Growth."" US applicants: Click here to view the ""EEO is the Law"" poster. If you are a qualified individual with a disability or a disabled veteran, you may request a reasonable accommodation in the event you are unable or limited in your ability to use or access the Company’s career webpage as a result of your disability. You may request a reasonable accommodation(s) by calling 888-237-7769 or by sending an email to BRcareers@broadridge.com"
0,78,Entry,"Sourcing is a core strategic driver of Facebook’s success. As a member of our team, the Sourcer works closely with our Recruiters and hiring managers to develop strategies to find untapped candidates. We conceive practical and creative ways to surface leading talent, and we invest a lot of time activating passive candidates through a highly engaged and diversity driven approach. We’re passionate about delivering exceptional experiences, and that starts with the first conversation a candidate has with us, which is more often than not with a member of our Sourcing team. Collaborate with Recruiters and hiring managers to deeply understand requirements of the role, the function and how it fits into the organization Help to define, design and implement search strategies for a variety of roles. This includes understanding and mapping the talent landscape Strategize different ways to build talent pipelines and execute on tactical research, referral generation, events and sourcing campaigns Find, engage and activate passive candidates through alternative search techniques Screen resumes and interview candidates Foster trust-based relationships with candidates, gaining a close understanding of their requirements and concerns. Support an exemplary candidate experience at every stage of the process Proactively recommend and drive process improvements that impact candidate identification and engagement Regularly track pipeline activity to share with internal stakeholders Work in ambiguous situations while embracing change Move quickly and efficiently amongst competing roles and priorities Quickly develop productive partnerships and insights to influence stakeholders 2+ years sourcing/recruiting experience Experience working with and building sourcing strategies with hiring managers Experience researching, sourcing, and approaching passive candidates Experience building working relationships with leaders and cross-functional partners Experience with use of talent market insights and data to influence decisions within the leadership groups and cross-functional teams Experience working in a team-based environment Experience partnering with recruiters and hiring partners across different offices Full cycle recruiting experience across multiple tech/product disciplines Facebook's mission is to give people the power to build community and bring the world closer together. Through our family of apps and services, we're building a different kind of company that connects billions of people around the world, gives them ways to share what matters most to them, and helps bring people closer together. Whether we're creating new products or helping a small business expand its reach, people at Facebook are builders at heart. Our global teams are constantly iterating, solving problems, and working together to empower people around the world to build community and connect in meaningful ways. Together, we can help people build stronger communities - we're just getting started. Facebook is proud to be an Equal Opportunity and Affirmative Action employer. We do not discriminate based upon race, religion, color, national origin, sex (including pregnancy, childbirth, or related medical conditions), sexual orientation, gender, gender identity, gender expression, transgender status, sexual stereotypes, age, status as a protected veteran, status as an individual with a disability, or other applicable legally protected characteristics. We also consider qualified applicants with criminal histories, consistent with applicable federal, state and local law. Facebook is committed to providing reasonable accommodations for candidates with disabilities in our recruiting process. If you need any assistance or accommodations due to a disability, please let us know at accommodations-ext@fb.com."
0,79,Entry,"Virtual Data Science Intern, Summer 2021 Location New York, New York Business: Turner Position Type: Intern Job ID 181661BR Company Overview WarnerMedia is a leading media and entertainment company that creates and distributes premium and popular content from a diverse array of talented storytellers and journalists to global audiences through its consumer brands including: HBO, HBO Max, Warner Bros., TNT, TBS, truTV, CNN, DC Entertainment, New Line, Cartoon Network, Adult Swim, Turner Classic Movies and others. The WarnerMedia Story WarnerMedia is a leading media and entertainment company that creates and distributes premium and popular content from a diverse array of talented storytellers and journalists to global audiences through its consumer brands including: HBO, HBO Now, HBO Max, Warner Bros., TNT, TBS, truTV, CNN, DC Entertainment, New Line, Cartoon Network, Adult Swim, Turner Classic Movies and others. The Job Develop video labeling models to identify objects, individuals and scene breaks of interest. Work with human annotators to develop a rigorous precision measure and quality assurance process. The Daily Working through our internal ContentAI platform, you’ll identify high quality, labelled video samples, train computer vision and/or NLP models and confirm the accuracy of their outputs The Essentials This role should be filled by someone finishing a degree in or having significant experience with Machine Learning, Artificial Intelligence (particularly with a focus on Computer Vision) This role requires programming competence sufficient to build these models without supervision using PyTorch, TensorFlow, etc Internship Program Students must be currently enrolled in a college degree program for full duration of the internship Summer 2021 program dates are June 7th - August 13th; must be available for full program duration Full-time schedule (40 hours/week) designed to work around class schedule Fully remote/virtual experience; company owned laptop provided for the duration of the internship program Salary based on office location; relocation is not provided The Perks Hands-on work with passionate, talented team members in your field Networking opportunities with industry-leading professionals Engaging events including executive speakers sessions, professional development workshops, and more Opportunity to join the WarnerMedia family of powerhouse brands Warner Media, LLC and its subsidiaries are equal opportunity employers. Qualified candidates will receive consideration for employment without regard to race, color, religion, national origin, gender, sexual orientation, gender identity or expression, age, mental or physical disability, and genetic information, marital status, citizenship status, military status, protected veteran status or any other category protected by law. Warner Media, LLC and its subsidiaries are equal opportunity employers. Qualified candidates will receive consideration for employment without regard to race, color, religion, national origin, gender, sexual orientation, gender identity or expression, age, mental or physical disability, and genetic information, marital status, citizenship status, military status, protected veteran status or any other category protected by law."
0,80,Entry,"The Role Labeled data is the critical ingredient for training powerful Deep Neural Networks, which help drive the Tesla vehicles autonomously. In this role you will work with a user interface to label images for cars, lanes, street signs, etc. Responsibilities You will use the Autopilot labeling interface to label images critical to training our deep neural networks. You will interact with the computer vision engineers on the Autopilot team to help us improve on the design of an efficient labeling interface. You will be expected to gain basic computer vision and machine learning knowledge to better understand how the labels are used by our learning algorithms, as this will allow you to make more judgement calls on difficult edge cases that might come up during labeling. Requirements Valid Driver's License High School diploma or evidence of exceptional ability. Passionate and curious about technology. Available to work overtime as needed. Able to work in a fast paced environment, learn quickly and be able to prioritize assignments. Proficient computer skills utilizing keyboard/mouse. Detail-oriented and patient. Communicate clearly using excellent written and verbal skills. Must be reliable, have good initiative, committed and quality focused. Proficient in Microsoft Office Suite is a plus. Available for work schedule between 12:00 pm to 8:30 pm Monday-Friday at Tesla's Buffalo building"
