,ID,Heading,Heading Text
0,0,Entry,"This position can be based remotely anywhere in the USA, or based in Tonawanda, NY."
1,0,Position Summary,"This is a unique opportunity to collaborate with a diverse team of technical experts to solve a variety of complex problems in a fun and dynamic environment. With flexibility to use the latest tools and technology, imagination and creativity are the only limitations on your impact!"
2,0,Key Accountabilities,Collaborate with business partners to understand product requirements and define appropriate technical solutions Lead technical development of cutting-edge analytics and decision support tools Stay abreast of new technology and actively contribute ideas for new programs Balance development of new solutions with replication and support of existing tools
3,0,Desired Skills and Experience,
4,0,Basic Requirements,"BS degree in Industrial Engineering, Chemical Engineering, Computer Science, Statistics or Operations Research with a specialization in data science or analytics Excellent analytical and problem-solving skills Passion for technology with a strong emphasis on user experience and business value Ability to succinctly convey complex solutions to business stakeholders and executive leadership Willingness to work in an agile and dynamic environment Availability to travel up to 30%, domestic and international"
5,0,Preferred Qualifications,"MS or higher degree in Industrial Engineering, Chemical Engineering, Computer Science, Statistics or Operations Research with a specialization in data science or analytics 5+ years of relevant industry experience Deep knowledge of machine learning and/or operations research theory with practical development experience Strong programming skills in Python or at least one major programming language Demonstrated ability to follow software development best practices Ability to develop, implement and support production level data science pipelines Experience with APIs and microservices Experience with web application development Experience deploying solutions to cloud providers, preferably Azure Experience designing and using relational databases, NoSQL data stores and data historians Experience with data visualization Experience with Docker and Linux environments"
0,1,Entry,
1,1,Summary,"Imagine what you could do here. At Apple, new ideas have a way of becoming outstanding products, services, and customer experiences very quickly. Bring passion and dedication to your job and there's no telling what you could accomplish."
2,1,Key Qualifications,"Practical experience with and theoretical understanding of algorithms for classification, regression, clustering, and anomaly detection"
3,1,Description,"• Engage with business teams to find opportunities, understand requirements, and translate those requirements into technical solutions"
4,1,Education & Experience,"• Ph.D. in Computer Science, Machine Learning, Statistics, Operations Research or related field; or"
0,2,Entry,"Lead analytics and measurement efforts for strategic accounts using the LXM approach – e.g., Existing and new promising accounts.Proactively identify and define data and learning opportunities that solve or support client objectives and create visibility to performance and the levers that drive it.Participate in client team scoping and road-mapping to ensure analytics needs are properly planned and are visible to and supported by the client and delivery teams.Develop measurement plans and strategies to provide program insights, address learning objectives and improve program effectiveness.Develop blueprints, learning roadmaps, work proposals, and data strategy presentations that outline solutions that measure against the client’s objectives and provide insights that reveal or empower opportunities for improving performance.Provide thought leadership and act as the subject matter expert in the deployment of data-driven solutions, measurement, and analytics – be familiar with multiple approaches and recommend the one that best drives to the client need.Oversee the full analytics lifecycle from problem identification, solutioning, requirements development, solution creation and results delivery.Write and/or review briefs to external resources that define and specify requirements for more in-depth analytics projects (exploratory, descriptive, and predictive analytics, ML, AI) and lead/oversee the delivery of solutions from the results.Complete the work with a cogent presentation of findings with actionable recommendations.Where needed, apply statistical concepts and techniques to analyze experiments and predict user behavior and behavioral drivers for accuracy and client alignment."
1,2,Additional Information,"Merkle fosters a diverse environment that encourages original thinking about our business and empowers us to communicate with a global world of customers. We embrace differences of opinion and diversity of thought as they help us challenge and refine our solutions. Merkle, as a best-in-class marketing agency, welcomes big ideas, and believes they can come from anywhere."
2,2,Perks & Benefits,"Merkle offers a flexible vacation policy, retirement benefits, paid sick leave, generous health, dental and vision insurance options, parental leave, adoption benefits, and more. We recognize high-performers and provide long-term growth opportunities. We hope you'll join us!"
3,2,FLSA Status: Exempt,
4,2,Desired Skills and Experience,"4+ years’ experience in data science or analytics roles delivering campaign and audience measurement, data-driven insights, predictive modeling, and recommendations to internal or external clients.Ability to articulate analytics expertise through the work of others – by leading technical resources to perform the analyses and leading the client team through recommending, championing, and briefing those analyses.Demonstrated strong presentation and storytelling with data skills. Be able to deliver clear value while simplifying the complexity for business audience and partnering with other disciplines to deliver recommendations.Familiarity and some experience using predictive modeling approaches, including machine learning, AI, clustering, regression, ensemble modeling, and decision trees.Ability to query, manipulate, extract, and analyze structured data from large data repositories to generate actionable insights that deliver business resultsFamiliarity with experimental design and offer testing methodologyExperience with cloud-based big data platforms – e.g., Redshift, Big Query, Teradata.Bachelor’s degree or master’s (preferred) in a quantitative field (STEM or quantitative social sciences) and/or MBA with strong quant background.Strong organizational skills – task prioritization, effective time management, meeting facilitation, conflict resolution, and risk identification/mitigationStrong business skills – understand and identify key business levers and tailor recommendations that tap them.Knowledge of the digital marketing ecosystem and fluency with common web technologies is strongly preferredStrong strategic thinking and prioritization skillsExperience with Power BI or other front-end visualization tool is a plus"
0,3,Entry,
1,3,About Gusto,"Gusto is a modern, online people platform that helps small businesses take care of their teams. On top of full-service payroll, Gusto offers health insurance, 401(k)s, expert HR, and team management tools. Today, Gusto offices in Denver, San Francisco, and New York serve more than 100,000 businesses nationwide."
2,3,Here’s What You’ll Do Day-to-day,"Work closely with product groups to define, measure and report on core product and feature metrics, and to define standards and practices for how product groups work with data Perform in-depth analyses of our Payroll, Benefits and HR product data to inform and guide product direction and strategy Design and analyze customer-facing experiments Work with our business intelligence teams to turn your insights and analyses into clean and consistent reporting Be a strong voice for a data-informed point of view within our engineering, product and design organization Collaborate with UX research to design surveys and provide quantitative insights on customer experience"
3,3,Here’s What We're Looking For,"At least 2 years experience in a similar role, ideally at a product-focused software company Strong SQL skills, and comfortable in at least one scripting or statistical programming language (ideally Python and/or R) Strong knowledge of statistics and experiment design and ability to apply these to conducting and interpreting analyses, data visualization, presentation and recommendations Excellent communicator - able to effectively deliver findings and recommendations to non-technical stakeholders in a clear and compelling fashion Passionate about teaching and evangelizing a data-informed approach to product development to product managers, designers and engineers MS or PhD in a quantitative field + at least 1-2 years experience in a business environment, or BS or Data Science Bootcamp graduate + equivalent experience in a business setting considered"
0,4,Entry,
1,4,Summary,"At Apple, new ideas have a way of becoming great products, services, and customer experiences very quickly. If you are an ambitious, high-energy individual who is not afraid of challenges, we’re looking for you."
2,4,Key Qualifications,"Demonstrated ability in a Data Scientist or Data Analyst role, preferably from a role passionate about search and discovery. Domain knowledge in music, mobile apps, or video content is a plus."
3,4,Strong proficiency with SQL-based languages.,"Experience with large scale analytics technologies such as Hadoop and Spark preferred. Experience with Python, R or comparable language."
4,4,Description,"Dive deep into large-scale data to uncover trends and identify key insights that will drive App Store product and design strategy. Craft how best to monitor, measure and understand product and business performance around search and discovery. Collaborate with business, marketing, finance and executive teams to generate regular presentations for C-level. Partner with other Apple organizations on data gathering, data governance, evangelizing key performance indicators and democratizing data. Your creative skills will be utilized daily"
5,4,Education & Experience,"Minimum of a Bachelors degree in Computer Science, Statistics, Mathematics, Engineering, Economics or related field. Ideally, Masters or PhD in related field"
0,5,Entry,"Lead analytics and measurement efforts for strategic accounts using the LXM approach – e.g., Existing and new promising accounts.Proactively identify and define data and learning opportunities that solve or support client objectives and create visibility to performance and the levers that drive it.Participate in client team scoping and road-mapping to ensure analytics needs are properly planned and are visible to and supported by the client and delivery teams.Develop measurement plans and strategies to provide program insights, address learning objectives and improve program effectiveness.Develop blueprints, learning roadmaps, work proposals, and data strategy presentations that outline solutions that measure against the client’s objectives and provide insights that reveal or empower opportunities for improving performance.Provide thought leadership and act as the subject matter expert in the deployment of data-driven solutions, measurement, and analytics – be familiar with multiple approaches and recommend the one that best drives to the client need.Oversee the full analytics lifecycle from problem identification, solutioning, requirements development, solution creation and results delivery.Write and/or review briefs to external resources that define and specify requirements for more in-depth analytics projects (exploratory, descriptive, and predictive analytics, ML, AI) and lead/oversee the delivery of solutions from the results.Complete the work with a cogent presentation of findings with actionable recommendations.Where needed, apply statistical concepts and techniques to analyze experiments and predict user behavior and behavioral drivers for accuracy and client alignment."
1,5,Additional Information,"Merkle fosters a diverse environment that encourages original thinking about our business and empowers us to communicate with a global world of customers. We embrace differences of opinion and diversity of thought as they help us challenge and refine our solutions. Merkle, as a best-in-class marketing agency, welcomes big ideas, and believes they can come from anywhere."
2,5,Perks & Benefits,"Merkle offers a flexible vacation policy, retirement benefits, paid sick leave, generous health, dental and vision insurance options, parental leave, adoption benefits, and more. We recognize high-performers and provide long-term growth opportunities. We hope you'll join us!"
3,5,FLSA Status: Exempt,
4,5,Desired Skills and Experience,"4+ years’ experience in data science or analytics roles delivering campaign and audience measurement, data-driven insights, predictive modeling, and recommendations to internal or external clients.Ability to articulate analytics expertise through the work of others – by leading technical resources to perform the analyses and leading the client team through recommending, championing, and briefing those analyses.Demonstrated strong presentation and storytelling with data skills. Be able to deliver clear value while simplifying the complexity for business audience and partnering with other disciplines to deliver recommendations.Familiarity and some experience using predictive modeling approaches, including machine learning, AI, clustering, regression, ensemble modeling, and decision trees.Ability to query, manipulate, extract, and analyze structured data from large data repositories to generate actionable insights that deliver business resultsFamiliarity with experimental design and offer testing methodologyExperience with cloud-based big data platforms – e.g., Redshift, Big Query, Teradata.Bachelor’s degree or master’s (preferred) in a quantitative field (STEM or quantitative social sciences) and/or MBA with strong quant background.Strong organizational skills – task prioritization, effective time management, meeting facilitation, conflict resolution, and risk identification/mitigationStrong business skills – understand and identify key business levers and tailor recommendations that tap them.Knowledge of the digital marketing ecosystem and fluency with common web technologies is strongly preferredStrong strategic thinking and prioritization skillsExperience with Power BI or other front-end visualization tool is a plus"
0,6,Entry,
1,6,Summary,"Would you like to play a part in the next revolution in human-computer interaction? Contribute to a product that is redefining mobile and desktop computing, and work with the people who built the intelligent assistant that helps millions of people get things done — just by asking? The vision for the Siri Data organization is to improve Siri by using data as the voice of our customers. Within this organization the mission of the Analytics team is to inform the evolution of Siri through measurement and analysis of the user experience. As an Embedded Data Scientist on the team, you will be an ambassador of analytics to product and engineering teams with the ultimate purpose of improving the Siri experience for Apple customers."
2,6,Key Qualifications,"You think about data in terms of statistical distributions and have a big enough analytics toolbox to know how to find patterns in data, identify targets for performance, and identify sources of variance about those targets."
3,6,Description,"You will partner closely with Siri engineering teams to develop ways of characterizing the user experience in how Siri executes on requests and connecting those characterizations into Siri's development. • Define metrics that we will measure our efforts against as well as defining the instrumentation required for yielding sufficient data. • Communicate with and advocate to a wide audience of engineers, managers and executives to inform decisions on how Siri evolves. • Build analytic, visualization, and other information products with a drive to automate and scale the insights available to science and engineering teams. • Perform exploratory data analyses to enrich our mental models about Siri usage and identify new questions to pursue. • Extract information from structured and unstructured data coming from Siri's computational architecture."
4,6,Education & Experience,"We are looking for people with a track record in building insights and relationships to affect decisions. Join us, and impact hundreds of millions of customers across billions of their interactions with a personal, intelligent assistant who is available on iPhone, iPad, HomePod, Watch, TV, and Mac across more than 30 languages."
0,7,Entry,
1,7,Summary,"At Apple, great ideas have a way of becoming phenomenal products, services, and customer experiences very quickly. If you are an ambitious, high-energy individual who is not afraid of challenges, we’re looking for you. Apple is seeking an expert Data Scientist to join a team passionate about Data Science & Analytics for the media space. This role will primarily focus on Apple One, which includes subscription across Apple services - Apple Music, Apple TV+, Apple Arcade, iCloud, Apple News+, and Apple Fitness+. This role will involve working with Internet-scale data across numerous product and customer touch points, undertaking in-depth quantitative analysis, building models and partnering with business stakeholders across multiple products to drive strategy. The team’s culture is centered around rapid iteration with open feedback and debate along the way. We encourage independent decision-making and taking calculated risks. AMP Data Science collaborates with partners across product, design, engineering, and business teams: our mission is to drive innovation at Apple through deep quantitative research of the App Store, Apple Music, Apple TV, and Apple Arcade amongst other services."
2,7,Key Qualifications,4+ years of experience in a Data Scientist or Data Analyst role in the digital media or entertainment businesses.
3,7,Description,"Dive deep into large-scale data to uncover trends and identify key insights that will inform business strategy. Craft how best to monitor, measure and understand business performance and build out associated Keynote narratives, datasets, and dashboards. Work closely across multiple teams including business, marketing, finance and executive teams to generate regular presentations for C-level. Partner with other Apple organizations on data gathering, data governance, evangelizing key performance indicators and democratizing data."
4,7,Education & Experience,"Bachelors degree in Computer Science, Statistics, Mathematics, Engineering, Economics or related technical field. Masters degree preferred."
0,8,Entry,"Facebook's mission is to give people the power to build community and bring the world closer together. Through our family of apps and services, we're building a different kind of company that connects billions of people around the world, gives them ways to share what matters most to them, and helps bring people closer together. Whether we're creating new products or helping a small business expand its reach, people at Facebook are builders at heart. Our global teams are constantly iterating, solving problems, and working together to empower people around the world to build community and connect in meaningful ways. Together, we can help people build stronger communities - we're just getting started."
1,8,Responsibilities,"Apply your technical expertise to help solve, inform, influence, support, and execute our HR business decisions for the People Analytics team and all of our clients (HR Business Partners, L&D, Diversity, People Growth, People Operations, Global Mobility, Benefits, and Equity)Use tools and programming languages like Tableau, Hive, Oracle, R, Python, Excel, Workday, Visier and many other internal tools to work efficiently at scaleMaintain code-base (SQL) used to drive self-service tools, and recommend opportunities for improvementCreate and iterate on solutions and dashboards to empower operational and exploratory analysisEnforce best practices and alignment with research, forecasting, analytics, and engineering teamsEffectively communicate with external clients and internal teams to deliver solutions in a timely fashionRespond to (or triage) any and all requests related to people data with minimal guidance or oversightDocument requirements with stakeholders, and partner with People Insights and People Analytics on broader changes to core dashboards and solutions"
2,8,Minimum Qualification,"BA/BS in a field that emphasizes data analysis and visualization (e.g., computer science, social sciences, physical sciences, math, engineering, or statistics), or equivalent work experience3+ years experience with SQL (or similar language aimed at querying relational databases)3+ years of experience working with data visualization toolsKnowledge with Excel (conditional formulas and formatting, charting, etc.)Experience with data management, specifically with validating and auditing data and reports from multiple systemsExperience manipulating large data sets through statistical software or other methodsExperience initiating and driving projects to completion with minimal guidanceExperience processing and analyzing data sets, interpreting them for making business decisionsExperience communicating the results of analyses with product and leadership teams to influence the overall strategy of the product"
3,8,Preferred Qualification,"2+ years of experience with R, Python, or a similar scripting languageExperience working with HR/organizational people data (e.g. headcount, turnover, recruiting metrics, and other people analytics)Project management experience"
0,9,Entry,
1,9,Job Summary,"The Data Scientist Intern on the Disney Media & Entertainment Distribution (DMED) Digital Media – Forecasting & Analytics team will be responsible for developing predictive models of movies viewership on Freeform and FX, to support digital ad sales inventory forecasts. This process will involve data gathering and exploration to model development and deployment, working together with operations teams to understand rapidly shifting strategies and business needs. The Data Scientist Intern position is a technical and analytical role, with the ability to effectively communicate complex results and insights to business stakeholders."
2,9,Responsibilities,"Data Exploration: Translate raw data into meaningful and useful insights for data-driven decision making. Analyze data to identify patterns, test hypotheses, and create a common understanding of digital movie consumption.Forecasting: Leverage statistical and machine learning methods to measure and project a user’s engagement with movies on the Disney platforms across many KPIs. Develop and implement improvements to forecast models that enhance the prediction accuracy.Integration: Create user-friendly interfaces for stakeholders to provide information and easily digest outputs via visualizations, dashboards, and reports.Collaboration: We are looking for a results-oriented team member to join us in a fast-paced cross-functional environment, with excellent time management skills and a commitment to contributing effectively in a cooperative team environment."
3,9,Basic Qualifications,"Experience using SQL and Python for data analysisExperience designing and implementing predictive models (generalized linear models, time series, etc.)Experience acquiring, cleansing, manipulating, and loading large amounts of dataExperience with data visualization tools (e.g. Tableau, PowerBI) Communication skills; able to shift between technical and non-technical terminology depending on audienceOpenness to learn new technologies and troubleshoot complex problems with creative problem-solving solutionsProven sense of responsibility, curiosity, and effective project ownershipComfort with messy data and ambiguity in a rapidly evolving industryStrong interpersonal skills, building relationships across teams and functions to advance business goals"
4,9,Preferred Qualifications,"Experience using GitExperience building frontend and backend web applications (e.g. Django, React JS, JQuery)Experience with ETL and cloud infrastructure"
5,9,Required Education,"Junior, Senior, or Graduate level student pursuing a degree from an accredited college or university. Or recently graduated from an accredited college or university within the last 18 months."
6,9,Additional Information,"At the time of application, must be enrolled in an accredited college/university taking at least one class in the semester/quarter (spring/fall) prior to participation in the internship program OR must have graduated from a college/university within the past 18 months OR currently participating in a Disney College Program or Disney Professional InternshipMust be at least 18 years of ageMust not have completed one year of continual employment on a Disney internship or program.Must possess unrestricted work authorizationMust provide full work availabilityCurrent Active Disney cast members must meet Professional Internship transfer guidelines (for Walt Disney World cast members this is no more than four points and one reprimand in the last six months; for Disneyland cast members this is six months of consecutive service and a performance record clear of any disciplinary issues (warnings, suspensions, etc.) for at least six months)"
